{
  "schema_version": "motionkb/v2",
  "action_id": "idle",
  "display_name": "Standing Idle",
  "status": "accepted",
  "source_clip": {
    "fbx_or_anim": "Idle.anim",
    "guid": "48e5834385783b14e8615a5bb1b7c0b0",
    "file_id": 7400000,
    "clip_name": "Idle"
  },
  "controller_state": "Idle",
  "controller_layer": "Base Layer",
  "trigger_param": null,
  "duration": 8.367,
  "frame_rate": 30,
  "loop": true,
  "overall_intent": "The nurse stands neutrally at rest with a relaxed whole-body posture.",
  "tags": [
    "idle",
    "standing",
    "neutral_pose",
    "resting",
    "nurse",
    "ready",
    "relaxed",
    "full_body"
  ],
  "mask_coverage": {
    "upper_body": true,
    "hands": true,
    "lower_body": true
  },
  "channels": {
    "torso": {
      "role": "free",
      "motion_type": "hold-static",
      "contact": "none",
      "constraint": "unconstrained",
      "target": null,
      "motion_description": "The torso remains upright in a neutral standing posture.",
      "kind": "fk_part",
      "state_label": "static",
      "motion_magnitude": 0.0432,
      "raw_measurement": {
        "signal": "max_torso_lean_deg",
        "raw_value": 2.33066,
        "divisor": 54.0
      }
    },
    "head": {
      "role": "free",
      "motion_type": "gaze",
      "contact": "none",
      "constraint": "unconstrained",
      "target": null,
      "motion_description": "The head stays generally forward with a calm neutral gaze.",
      "kind": "fk_part",
      "state_label": "static",
      "motion_magnitude": 0.099,
      "raw_measurement": {
        "signal": "head_vs_spine_range_deg",
        "raw_value": 1.52495,
        "divisor": 15.4
      }
    },
    "left_arm": {
      "role": "free",
      "motion_type": "hold-static",
      "contact": "none",
      "constraint": "unconstrained",
      "target": null,
      "motion_description": "The left arm hangs relaxed at the side.",
      "kind": "fk_part",
      "state_label": "static",
      "motion_magnitude": 0.0327,
      "raw_measurement": {
        "signal": "mean_bone_hips_rel_pos_stddev_m",
        "raw_value": 0.00448,
        "divisor": 0.137
      }
    },
    "right_arm": {
      "role": "free",
      "motion_type": "hold-static",
      "contact": "none",
      "constraint": "unconstrained",
      "target": null,
      "motion_description": "The right arm hangs relaxed at the side.",
      "kind": "fk_part",
      "state_label": "static",
      "motion_magnitude": 0.0281,
      "raw_measurement": {
        "signal": "mean_bone_hips_rel_pos_stddev_m",
        "raw_value": 0.00385,
        "divisor": 0.137
      }
    },
    "left_leg": {
      "role": "free",
      "motion_type": "hold-static",
      "contact": "ground",
      "constraint": "unconstrained",
      "target": null,
      "motion_description": "The left leg remains planted in a neutral standing stance.",
      "kind": "fk_part",
      "state_label": "static",
      "motion_magnitude": 0.0111,
      "raw_measurement": {
        "signal": "mean_bone_world_pos_stddev_m",
        "raw_value": 0.00275,
        "divisor": 0.247
      }
    },
    "right_leg": {
      "role": "free",
      "motion_type": "hold-static",
      "contact": "ground",
      "constraint": "unconstrained",
      "target": null,
      "motion_description": "The right leg remains planted in a neutral standing stance.",
      "kind": "fk_part",
      "state_label": "static",
      "motion_magnitude": 0.0127,
      "raw_measurement": {
        "signal": "mean_bone_world_pos_stddev_m",
        "raw_value": 0.00314,
        "divisor": 0.247
      }
    },
    "left_hand": {
      "role": "free",
      "motion_type": "hold-static",
      "contact": "none",
      "constraint": "unconstrained",
      "target": null,
      "motion_description": "The left hand rests open and relaxed beside the body.",
      "kind": "hand",
      "state_label": "static",
      "motion_magnitude": 0.0,
      "raw_measurement": {
        "signal": "mean_finger_curl_range_deg",
        "raw_value": 0.00033,
        "divisor": 129.0
      }
    },
    "right_hand": {
      "role": "free",
      "motion_type": "hold-static",
      "contact": "none",
      "constraint": "unconstrained",
      "target": null,
      "motion_description": "The right hand rests open and relaxed beside the body.",
      "kind": "hand",
      "state_label": "static",
      "motion_magnitude": 0.0,
      "raw_measurement": {
        "signal": "mean_finger_curl_range_deg",
        "raw_value": 0.00044,
        "divisor": 129.0
      }
    },
    "root": {
      "kind": "root",
      "state_label": "static",
      "motion_magnitude": 0.0141,
      "raw_measurement": {
        "signal": "max(gait/0.317, trans/0.30, heading/60)",
        "gait_foot_yrange_m": 0.00195,
        "trans_horiz_stddev_m": 0.00422,
        "heading_signed_stddev_deg": 0.0
      }
    }
  },
  "ik_goals": [],
  "composability": {
    "locks": [],
    "free": [
      "torso",
      "head",
      "left_arm",
      "right_arm",
      "left_leg",
      "right_leg",
      "left_hand",
      "right_hand"
    ],
    "can_overlay_on": [],
    "base_or_overlay": "base",
    "posture": "standing",
    "seam_owner": {
      "torso": "base",
      "root": "base"
    }
  },
  "extraction": {
    "method": "in_engine_sample_root_local",
    "sampled_frames": 251,
    "sampling_rule": "clamp(round(duration*frame_rate),2,600), native rate, root-local",
    "motion_metric": "torso: max_lean_deg/54; head: head_vs_spine_range_deg/15.4; arms: mean_bone_hips_rel_pos_stddev_m/0.137; legs: mean_bone_world_pos_stddev_m/0.247; hands: mean_finger_curl_range_deg/129; root: max(gait/0.317, trans/0.30, heading/60)",
    "bone_map_version": "v2.0.0",
    "metric_formula_version": "v2.0.0",
    "extractor_version": "2.0.0",
    "extractor_lang": "python",
    "avatar": "nurse_avatar.fbx",
    "extracted_at": "2026-07-01T20:17:47Z",
    "field_origin": {
      "measured": [
        "duration",
        "frame_rate",
        "channels.*.state_label",
        "channels.*.motion_magnitude",
        "channels.*.raw_measurement"
      ],
      "resolved": [
        "controller_state",
        "controller_layer",
        "trigger_param"
      ],
      "semantic": [
        "display_name",
        "overall_intent",
        "tags",
        "mask_coverage",
        "channels.*.motion_description",
        "ik_goals"
      ],
      "semantic_pending": [],
      "vlm_proposed": [
        "action_id",
        "display_name",
        "overall_intent",
        "tags",
        "mask_coverage",
        "channels.*.role",
        "channels.*.motion_type",
        "channels.*.contact",
        "channels.*.constraint",
        "channels.*.motion_description",
        "composability.base_or_overlay",
        "composability.posture",
        "composability.can_overlay_on"
      ],
      "derived": [
        "composability.locks",
        "composability.free",
        "composability.seam_owner",
        "ik_goals"
      ]
    },
    "verified_against_screenshots": false,
    "vlm_proposal": {
      "model": "gpt-5.5-2026-04-23",
      "proposed_at": "2026-07-01T20:41:26Z",
      "frames": 6,
      "render_views": [
        "front_left_3q",
        "side_right"
      ],
      "consistency_validated": true,
      "scope": [
        "action_id",
        "display_name",
        "overall_intent",
        "tags",
        "mask_coverage",
        "channels.*.role",
        "channels.*.motion_type",
        "channels.*.contact",
        "channels.*.constraint",
        "channels.*.motion_description",
        "composability.base_or_overlay",
        "composability.posture",
        "composability.can_overlay_on"
      ],
      "status": "vlm_accepted"
    },
    "verified_by": "auto-accepted: gpt-5.5 proposed + consistency-gated, no human review (ADR 0008)",
    "verified_at": "2026-07-01T21:42:45Z"
  }
}
